{
  "$schema": "../../schemas/eval_manifest.schema.json",
  "manifest_version": "1.0",
  "name": "aloha_sim_transfer_cube_eval_subsample",
  "environment_family": "ALOHA_SIM",
  "task_name": "Transfer cube",
  "config_name": "pi0_aloha_sim",
  "dataset_name": "lerobot/aloha_sim_transfer_cube_human",
  "split_name": "subsample",
  "prompt": "Transfer cube",
  "selection": {
    "policy": "fixed_subset_of_full_eval",
    "source": "manifests/aloha_sim_transfer_cube/eval_dataset_full.template.json",
    "seed": 42,
    "notes": "Populate with a fixed subset of the full eval manifest for periodic evaluation."
  },
  "records": []
}
